{
  "schemaVersion": "caatuu-target-realization-pack-v1",
  "packId": "caatuu.cs-CZ.shared-beginner",
  "version": "1.0.0",
  "specLocale": "en",
  "targetLocale": "cs-CZ",
  "supportLocales": [
    "en"
  ],
  "curriculum": {
    "id": "caatuu.shared-beginner",
    "version": "1.0.0"
  },
  "canonicalContractDigest": "sha256:ea771050c38c0bac732fa5ae02a0494b6505b98b8a635590ee3fa7ff2cb32dd9",
  "unitOrder": [
    "unit.interaction.entry-and-repair.01",
    "unit.needs.possession-and-choice.01",
    "unit.routine.familiar-actions.01"
  ],
  "unitBindings": [
    {
      "unitId": "unit.interaction.entry-and-repair.01",
      "canonicalRevision": 1,
      "functionBindings": [
        {
          "canonicalId": "function.greet",
          "mappingStatus": "direct",
          "targetSkillIds": [
            "cs.skill.function.greet"
          ],
          "utteranceIds": [
            "cs.utterance.ahoj",
            "cs.utterance.dobry-den"
          ]
        },
        {
          "canonicalId": "function.respond-to-greeting",
          "mappingStatus": "merged",
          "targetSkillIds": [
            "cs.skill.function.greet"
          ],
          "utteranceIds": [
            "cs.utterance.ahoj",
            "cs.utterance.dobry-den"
          ],
          "rationaleEn": "The same reviewed greeting formulas can initiate or answer the exchange."
        },
        {
          "canonicalId": "function.identify-self",
          "mappingStatus": "multiword",
          "targetSkillIds": [
            "cs.skill.function.identify-self"
          ],
          "utteranceIds": [
            "cs.utterance.jmenuji-se-anna"
          ]
        },
        {
          "canonicalId": "function.affirm",
          "mappingStatus": "direct",
          "targetSkillIds": [
            "cs.skill.function.affirm"
          ],
          "utteranceIds": [
            "cs.utterance.ano"
          ]
        },
        {
          "canonicalId": "function.reject",
          "mappingStatus": "direct",
          "targetSkillIds": [
            "cs.skill.function.reject"
          ],
          "utteranceIds": [
            "cs.utterance.ne"
          ]
        },
        {
          "canonicalId": "function.request-help",
          "mappingStatus": "multiword",
          "targetSkillIds": [
            "cs.skill.function.request-help"
          ],
          "utteranceIds": [
            "cs.utterance.prosim-pomozte-mi",
            "cs.utterance.pomoz-mi-prosim"
          ]
        },
        {
          "canonicalId": "function.request-repetition",
          "mappingStatus": "multiword",
          "targetSkillIds": [
            "cs.skill.function.request-repetition"
          ],
          "utteranceIds": [
            "cs.utterance.muzete-to-zopakovat",
            "cs.utterance.muzes-to-zopakovat"
          ]
        }
      ],
      "frameBindings": [
        {
          "canonicalId": "frame.social.greeting",
          "mappingStatus": "direct",
          "targetSkillIds": [
            "cs.skill.function.greet"
          ],
          "utteranceIds": [
            "cs.utterance.ahoj",
            "cs.utterance.dobry-den"
          ]
        },
        {
          "canonicalId": "frame.identity.self",
          "mappingStatus": "multiword",
          "targetSkillIds": [
            "cs.skill.function.identify-self"
          ],
          "utteranceIds": [
            "cs.utterance.jmenuji-se-anna"
          ]
        },
        {
          "canonicalId": "frame.polarity.response",
          "mappingStatus": "split",
          "targetSkillIds": [
            "cs.skill.function.affirm",
            "cs.skill.function.reject"
          ],
          "utteranceIds": [
            "cs.utterance.ano",
            "cs.utterance.ne"
          ],
          "rationaleEn": "Affirmation and rejection are taught as separate response skills within the same frame."
        },
        {
          "canonicalId": "frame.interaction.repair",
          "mappingStatus": "split",
          "targetSkillIds": [
            "cs.skill.function.request-help",
            "cs.skill.function.request-repetition"
          ],
          "utteranceIds": [
            "cs.utterance.prosim-pomozte-mi",
            "cs.utterance.muzete-to-zopakovat",
            "cs.utterance.pomoz-mi-prosim",
            "cs.utterance.muzes-to-zopakovat"
          ],
          "rationaleEn": "Help and repetition are distinct repair choices inside the canonical unit."
        }
      ],
      "conceptBindings": [
        {
          "canonicalId": "concept.person.self",
          "mappingStatus": "implicit",
          "targetSkillIds": [
            "cs.skill.function.identify-self"
          ],
          "utteranceIds": [
            "cs.utterance.jmenuji-se-anna"
          ],
          "rationaleEn": "The speaker is encoded by the first-person verb form and need not use an explicit pronoun."
        },
        {
          "canonicalId": "concept.person.other",
          "mappingStatus": "implicit",
          "targetSkillIds": [
            "cs.skill.function.greet"
          ],
          "utteranceIds": [
            "cs.utterance.ahoj",
            "cs.utterance.dobry-den"
          ],
          "rationaleEn": "The addressee is supplied by the interaction context."
        },
        {
          "canonicalId": "concept.polarity.yes",
          "mappingStatus": "direct",
          "targetSkillIds": [
            "cs.skill.function.affirm"
          ],
          "utteranceIds": [
            "cs.utterance.ano"
          ]
        },
        {
          "canonicalId": "concept.polarity.no",
          "mappingStatus": "direct",
          "targetSkillIds": [
            "cs.skill.function.reject"
          ],
          "utteranceIds": [
            "cs.utterance.ne"
          ]
        },
        {
          "canonicalId": "concept.assistance",
          "mappingStatus": "direct",
          "targetSkillIds": [
            "cs.skill.function.request-help"
          ],
          "utteranceIds": [
            "cs.utterance.prosim-pomozte-mi",
            "cs.utterance.pomoz-mi-prosim"
          ]
        },
        {
          "canonicalId": "concept.repetition",
          "mappingStatus": "multiword",
          "targetSkillIds": [
            "cs.skill.function.request-repetition"
          ],
          "utteranceIds": [
            "cs.utterance.muzete-to-zopakovat",
            "cs.utterance.muzes-to-zopakovat"
          ]
        }
      ],
      "targetSkillIds": [
        "cs.skill.function.greet",
        "cs.skill.function.identify-self",
        "cs.skill.function.affirm",
        "cs.skill.function.reject",
        "cs.skill.function.request-help",
        "cs.skill.function.request-repetition"
      ],
      "utteranceIds": [
        "cs.utterance.ahoj",
        "cs.utterance.dobry-den",
        "cs.utterance.jmenuji-se-anna",
        "cs.utterance.ano",
        "cs.utterance.ne",
        "cs.utterance.prosim-pomozte-mi",
        "cs.utterance.muzete-to-zopakovat",
        "cs.utterance.pomoz-mi-prosim",
        "cs.utterance.muzes-to-zopakovat"
      ],
      "contextIds": [
        "cs.context.u1.peer-meeting",
        "cs.context.u1.teacher-meeting",
        "cs.context.u1.peer-polarity",
        "cs.context.u1.helper-polarity",
        "cs.context.u1.peer-task-help",
        "cs.context.u1.teacher-task-help",
        "cs.context.u1.peer-hearing-repair",
        "cs.context.u1.teacher-hearing-repair"
      ],
      "realizationComplexity": {
        "receptive": 1,
        "productive": 2,
        "drivers": [
          "cs.register.greeting",
          "cs.reflexive.se",
          "cs.person-marking"
        ],
        "advisoryOnly": true
      },
      "withinUnitScaffolds": [
        "Introduce one informal and one polite greeting with clear social context.",
        "Treat first-person marking and reflexive se as support notes, not new curriculum units."
      ],
      "review": {
        "status": "prototype-not-human-approved",
        "notesEn": "Fixture content requires native Czech educator review before learner release."
      }
    },
    {
      "unitId": "unit.needs.possession-and-choice.01",
      "canonicalRevision": 1,
      "functionBindings": [
        {
          "canonicalId": "function.state-possession",
          "mappingStatus": "direct",
          "targetSkillIds": [
            "cs.skill.function.state-possession"
          ],
          "utteranceIds": [
            "cs.utterance.mam-knihu",
            "cs.utterance.mam-mic",
            "cs.utterance.mam-tuzku"
          ]
        },
        {
          "canonicalId": "function.state-want",
          "mappingStatus": "direct",
          "targetSkillIds": [
            "cs.skill.function.state-want"
          ],
          "utteranceIds": [
            "cs.utterance.chci-vodu",
            "cs.utterance.chci-dzus",
            "cs.utterance.chci-mic"
          ]
        },
        {
          "canonicalId": "function.state-need",
          "mappingStatus": "direct",
          "targetSkillIds": [
            "cs.skill.function.state-need"
          ],
          "utteranceIds": [
            "cs.utterance.potrebuji-pomoc",
            "cs.utterance.potrebuji-tuzku",
            "cs.utterance.potrebuji-vodu"
          ]
        },
        {
          "canonicalId": "function.state-like",
          "mappingStatus": "multiword",
          "targetSkillIds": [
            "cs.skill.function.state-like"
          ],
          "utteranceIds": [
            "cs.utterance.mam-rad-jablka",
            "cs.utterance.mam-rada-knihy",
            "cs.utterance.libi-se-mi-ten-mic"
          ]
        },
        {
          "canonicalId": "function.understand-simple-choice",
          "mappingStatus": "multiword",
          "targetSkillIds": [
            "cs.skill.function.understand-simple-choice"
          ],
          "utteranceIds": [
            "cs.utterance.chces-vodu-nebo-dzus",